Defect;Process;Description
Окалины;Нагрев сляба в печи (интенсивное окалинообразование);Перегрев/долгая выдержка и окислительная атмосфера формируют толстую окалину, которая при деформации разрушается и вдавливается в поверхность полосы.
Бляшки;Неравномерный нагрев в печи (skid marks, зоны перегрева/недогрева);Локальные отличия температуры дают разную толщину/состав оксидной плёнки и различную шероховатость, что после прокатки проявляется пятнами на поверхности.
Трещины;Прокатка при пониженной температуре конца прокатки;Недостаточная температура снижает пластичность поверхностного слоя, и при обжатии образуется сетка микротрещин (crazing).
Каверны;Питтинг/выкрашивание рабочих валков (roll pitting/spalling);Раковины и выкрашивания на валке отпечатываются на полосе множественными углублениями, часто с периодичностью по длине.
Включения;Захват шлака при выпуске/переливах (slag carryover);Частицы шлака и оксидные продукты попадают в металл, остаются близко к поверхности и после прокатки проявляются как включения/выкрашивания.
Царапины;Рольганги и направляющие (перекос, износ, налипшая окалина);Контакт полосы с дефектными роликами/направляющими или абразивной окалиной вызывает продольные царапины по ходу движения.
